<?xml version="1.0" encoding="utf-8"?>
<!DOCTYPE list SYSTEM "../tree.dtd">
<list>
	<normal_skill_tree>
		<class id="108"> <!--Призрачный Охотник-->
			<skill id="1322" level="1" name="Common Craft" cost="0" min_level="1"/>
			<skill id="1320" level="10" name="Common Craft Passive" cost="0" min_level="1"/>
			<skill id="246" level="1" name="Печать" cost="0" min_level="1"/>
			<skill id="6088" level="1" name="Блок Бафф" cost="0" min_level="1"/>
			<skill id="1405" level="3" name="Божественное Вдохновение(Divine Inspiration)" cost="5900000" min_level="76"/>
			<skill id="1405" level="4" name="Божественное Вдохновение(Divine Inspiration)" cost="5900000" min_level="76"/>
			<skill id="1630" level="1" name="Бросок Кровавого Кинжала(Throwing Blood Dagger)" cost="5900000" min_level="76"/>
			<skill id="209" level="46" name="Владение Кинжалом(Dagger Mastery)" cost="5900000" min_level="76"/>
			<skill id="233" level="48" name="Владение Легкой Броней(Light Armor Mastery)" cost="5900000" min_level="76"/>
			<skill id="223" level="50" name="Жало(Sting)" cost="5900000" min_level="76"/>
			<skill id="105" level="25" name="Замораживающий Удар(Freezing Strike)" cost="5900000" min_level="76"/>
			<skill id="70" level="54" name="Кража Здоровья(Drain HP)" cost="5900000" min_level="76"/>
			<skill id="96" level="7" name="Кровопускание(Bleed)" cost="5900000" min_level="76"/>
			<skill id="1835" level="1" name="Оседлать Саблезубого Кугуара(Mount Saber Tooth Cougar)" cost="0" min_level="76"/>
			<skill id="122" level="16" name="Сглаз(Hex)" cost="5900000" min_level="76"/>
			<skill id="263" level="38" name="Смертельный Импульс(Deadly Blow)" cost="5900000" min_level="76"/>
			<skill id="344" level="1" name="Смертоносный Удар(Lethal Blow)" cost="5900000" min_level="76"/>
			<skill id="115" level="18" name="Сокрушение Мощи(Power Break)" cost="5900000" min_level="76"/>
			<skill id="30" level="38" name="Удар в Спину(Backstab)" cost="5900000" min_level="76"/>
			<skill id="209" level="47" name="Владение Кинжалом(Dagger Mastery)" cost="5900000" min_level="77"/>
			<skill id="233" level="49" name="Владение Легкой Броней(Light Armor Mastery)" cost="5900000" min_level="77"/>
			<skill id="223" level="51" name="Жало(Sting)" cost="5900000" min_level="77"/>
			<skill id="70" level="55" name="Кража Здоровья(Drain HP)" cost="5900000" min_level="77"/>
			<skill id="531" level="1" name="Критическая Рана(Critical Wound)" cost="5900000" min_level="77"/>
			<skill id="1631" level="1" name="Сброс Движений(Clear Movements)" cost="5900000" min_level="77"/>
			<skill id="263" level="39" name="Смертельный Импульс(Deadly Blow)" cost="5900000" min_level="77"/>
			<skill id="30" level="39" name="Удар в Спину(Backstab)" cost="5900000" min_level="77"/>
			<skill id="209" level="48" name="Владение Кинжалом(Dagger Mastery)" cost="14000000" min_level="78"/>
			<skill id="233" level="50" name="Владение Легкой Броней(Light Armor Mastery)" cost="14000000" min_level="78"/>
			<skill id="223" level="52" name="Жало(Sting)" cost="14000000" min_level="78"/>
			<skill id="105" level="26" name="Замораживающий Удар(Freezing Strike)" cost="14000000" min_level="78"/>
			<skill id="70" level="56" name="Кража Здоровья(Drain HP)" cost="14000000" min_level="78"/>
			<skill id="412" level="11" name="Песочная Бомба(Sand Bomb)" cost="14000000" min_level="78"/>
			<skill id="122" level="17" name="Сглаз(Hex)" cost="14000000" min_level="78"/>
			<skill id="263" level="40" name="Смертельный Импульс(Deadly Blow)" cost="14000000" min_level="78"/>
			<skill id="115" level="19" name="Сокрушение Мощи(Power Break)" cost="14000000" min_level="78"/>
			<skill id="30" level="40" name="Удар в Спину(Backstab)" cost="14000000" min_level="78"/>
			<skill id="357" level="1" name="Фокусировка Мощности(Focus Power)" cost="14000000" min_level="78"/>
			<skill id="355" level="1" name="Фокусировка Смерти(Focus Death)" cost="14000000" min_level="78"/>
			<skill id="447" level="1" name="Контратака(Counterattack)" cost="14000000" min_level="79"/>
			<skill id="770" level="1" name="Походка Призрака(Ghost Walking)" cost="14000000" min_level="80"/>
		</class>
	</normal_skill_tree>
</list>