<?xml version="1.0" encoding="utf-8"?>
<!DOCTYPE list SYSTEM "tree.dtd">
<!--AUTHOR: Bonux-->
<list>
	<normal_skill_tree>
		<class id="109">	<!--Страж Теней-->
			<skill id="1405" level="3" name="Божественное Вдохновение(Divine Inspiration)" item_id="8620" cost="6300000" min_level="76"/>
			<skill id="1405" level="4" name="Божественное Вдохновение(Divine Inspiration)" item_id="8621" cost="6300000" min_level="76"/>
			<skill id="233" level="48" name="Владение Легкой Броней(Light Armor Mastery)" cost="6300000" min_level="76"/>
			<skill id="208" level="53" name="Владение Луком(Bow Mastery)" cost="6300000" min_level="76"/>
			<skill id="19" level="38" name="Двойной Выстрел(Double Shot)" cost="6300000" min_level="76"/>
			<skill id="415" level="1" name="Дух Стрельца(Spirit of Sagittarius)" cost="6300000" min_level="76"/>
			<skill id="223" level="50" name="Жало(Sting)" cost="6300000" min_level="76"/>
			<skill id="105" level="25" name="Замораживающий Удар(Freezing Strike)" cost="6300000" min_level="76"/>
			<skill id="70" level="54" name="Кража Здоровья(Drain HP)" cost="6300000" min_level="76"/>
			<skill id="53005" level="1" name="Найти Тьму()" cost="6300000" min_level="76"/>
			<skill id="314" level="17" name="Обратный Отсчет(Fatal Counter)" cost="6300000" min_level="76"/>
			<skill id="101" level="41" name="Оглушающий Выстрел(Stun Shot)" cost="6300000" min_level="76"/>
			<skill id="1835" level="1" name="Оседлать Саблезубого Кугуара(Mount Saber Tooth Cougar)" item_id="90040" min_level="76"/>
			<skill id="122" level="16" name="Сглаз(Hex)" cost="6300000" min_level="76"/>
			<skill id="343" level="1" name="Смертельный Выстрел(Lethal Shot)" cost="6300000" min_level="76"/>
			<skill id="115" level="18" name="Сокрушение Мощи(Power Break)" cost="6300000" min_level="76"/>
			<skill id="233" level="49" name="Владение Легкой Броней(Light Armor Mastery)" cost="6300000" min_level="77"/>
			<skill id="208" level="54" name="Владение Луком(Bow Mastery)" cost="6300000" min_level="77"/>
			<skill id="19" level="39" name="Двойной Выстрел(Double Shot)" cost="6300000" min_level="77"/>
			<skill id="223" level="51" name="Жало(Sting)" cost="6300000" min_level="77"/>
			<skill id="354" level="1" name="Калечащий Выстрел(Hamstring Shot)" cost="6300000" min_level="77"/>
			<skill id="70" level="55" name="Кража Здоровья(Drain HP)" cost="6300000" min_level="77"/>
			<skill id="314" level="18" name="Обратный Отсчет(Fatal Counter)" cost="6300000" min_level="77"/>
			<skill id="101" level="42" name="Оглушающий Выстрел(Stun Shot)" cost="6300000" min_level="77"/>
			<skill id="343" level="2" name="Смертельный Выстрел(Lethal Shot)" cost="6300000" min_level="77"/>
			<skill id="233" level="50" name="Владение Легкой Броней(Light Armor Mastery)" cost="14700000" min_level="78"/>
			<skill id="208" level="55" name="Владение Луком(Bow Mastery)" cost="14700000" min_level="78"/>
			<skill id="522" level="1" name="Главная Цель(Real Target)" item_id="90062" cost="14700000" min_level="78"/>
			<skill id="19" level="40" name="Двойной Выстрел(Double Shot)" cost="14700000" min_level="78"/>
			<skill id="223" level="52" name="Жало(Sting)" cost="14700000" min_level="78"/>
			<skill id="105" level="26" name="Замораживающий Удар(Freezing Strike)" cost="14700000" min_level="78"/>
			<skill id="70" level="56" name="Кража Здоровья(Drain HP)" cost="14700000" min_level="78"/>
			<skill id="314" level="19" name="Обратный Отсчет(Fatal Counter)" cost="14700000" min_level="78"/>
			<skill id="101" level="43" name="Оглушающий Выстрел(Stun Shot)" cost="14700000" min_level="78"/>
			<skill id="122" level="17" name="Сглаз(Hex)" cost="14700000" min_level="78"/>
			<skill id="343" level="3" name="Смертельный Выстрел(Lethal Shot)" cost="14700000" min_level="78"/>
			<skill id="115" level="19" name="Сокрушение Мощи(Power Break)" cost="14700000" min_level="78"/>
			<skill id="343" level="4" name="Смертельный Выстрел(Lethal Shot)" cost="14700000" min_level="79"/>
			<skill id="990" level="1" name="Укол Смерти(Death Sting)" item_id="90063" cost="14700000" min_level="79"/>
			<skill id="233" level="51" name="Владение Легкой Броней(Light Armor Mastery)" cost="14700000" min_level="80"/>
			<skill id="208" level="56" name="Владение Луком(Bow Mastery)" cost="14700000" min_level="80"/>
			<skill id="522" level="2" name="Главная Цель(Real Target)" cost="14700000" min_level="80"/>
			<skill id="19" level="41" name="Двойной Выстрел(Double Shot)" cost="14700000" min_level="80"/>
			<skill id="414" level="9" name="Мертвый Глаз(Dead Eye)" cost="14700000" min_level="80"/>
			<skill id="101" level="44" name="Оглушающий Выстрел(Stun Shot)" cost="14700000" min_level="80"/>
			<skill id="773" level="1" name="Призрачное Пробивание(Ghost Piercing)" item_id="90066" cost="14700000" min_level="80"/>
			<skill id="343" level="5" name="Смертельный Выстрел(Lethal Shot)" cost="14700000" min_level="80"/>
			<skill id="233" level="52" name="Владение Легкой Броней(Light Armor Mastery)" cost="160000000" min_level="81"/>
			<skill id="208" level="57" name="Владение Луком(Bow Mastery)" cost="160000000" min_level="81"/>
			<skill id="19" level="42" name="Двойной Выстрел(Double Shot)" cost="160000000" min_level="81"/>
			<skill id="101" level="45" name="Оглушающий Выстрел(Stun Shot)" cost="160000000" min_level="81"/>
			<skill id="343" level="6" name="Смертельный Выстрел(Lethal Shot)" cost="160000000" min_level="81"/>
			<skill id="233" level="53" name="Владение Легкой Броней(Light Armor Mastery)" cost="170000000" min_level="82"/>
			<skill id="208" level="58" name="Владение Луком(Bow Mastery)" cost="170000000" min_level="82"/>
			<skill id="522" level="3" name="Главная Цель(Real Target)" cost="170000000" min_level="82"/>
			<skill id="19" level="43" name="Двойной Выстрел(Double Shot)" cost="170000000" min_level="82"/>
			<skill id="101" level="46" name="Оглушающий Выстрел(Stun Shot)" cost="170000000" min_level="82"/>
			<skill id="343" level="7" name="Смертельный Выстрел(Lethal Shot)" cost="170000000" min_level="82"/>
			<skill id="233" level="54" name="Владение Легкой Броней(Light Armor Mastery)" cost="240000000" min_level="83"/>
			<skill id="208" level="59" name="Владение Луком(Bow Mastery)" cost="240000000" min_level="83"/>
			<skill id="19" level="44" name="Двойной Выстрел(Double Shot)" cost="240000000" min_level="83"/>
			<skill id="101" level="47" name="Оглушающий Выстрел(Stun Shot)" cost="240000000" min_level="83"/>
			<skill id="343" level="8" name="Смертельный Выстрел(Lethal Shot)" cost="240000000" min_level="83"/>
			<skill id="233" level="55" name="Владение Легкой Броней(Light Armor Mastery)" cost="240000000" min_level="84"/>
			<skill id="208" level="60" name="Владение Луком(Bow Mastery)" cost="240000000" min_level="84"/>
			<skill id="522" level="4" name="Главная Цель(Real Target)" cost="240000000" min_level="84"/>
			<skill id="19" level="45" name="Двойной Выстрел(Double Shot)" cost="240000000" min_level="84"/>
			<skill id="101" level="48" name="Оглушающий Выстрел(Stun Shot)" cost="240000000" min_level="84"/>
			<skill id="343" level="9" name="Смертельный Выстрел(Lethal Shot)" cost="240000000" min_level="84"/>
			<skill id="233" level="56" name="Владение Легкой Броней()" cost="840000000" min_level="85"/>
			<skill id="208" level="61" name="Владение Луком()" cost="840000000" min_level="85"/>
		</class>
	</normal_skill_tree>
</list>